Quote_ID,Category,Author,Quotes
78,DA,"Michael O'Connell, Chief Analytics Officer at TIBCO",Errors using inadequate data are much less than those using no data at all.
79,DA,"Edward Tufte, Statistician","When you are dealing with a torrent of data, being able to construct different levels of aggregation is really important, because you want to make sure you’ve used your software intelligently with respect to that large amount of data, and bring to bear the contextual data you need to answer the question at the level of aggregation that you need to answer it."
80,DA,"Chip & Dan Heath, Authors of Made to Stick, Switch","If statistics are boring, you've got the wrong numbers"
81,DA,"Avinash Kaushik, Entrepreneur, Author and Public Speaker",Data are just summaries of thousands of stories – tell a few of those stories to help make the data meaningful.
82,DA,"Marli Mesibov, VP of content strategy at Mad*Pow","[A data-first strategy] is the quest to implement systems (usually massive) to collect data of all shapes and manners before all else. [...]It is being hyper-conservative when it comes to creativity and experimentation because of quant-issues. It is represented by 90% of the data budget invested in Agencies and Consultants driving implementation and re-implementation and hyper-customization of the code. It is represented by the act of creating crazy data thresholds for any initiative to get off the ground. [...]  Data is important. I believe it can help drive your business strategy smartly. But, a data-first strategy, defined as above, is nuts. It will only slow down your progress and allow your competitors to crush you like a bug (even if you are a top player in your market today!).You can have data without information, but you cannot have information without data."
83,DA,"Daniel Gruhl, IBM researcher","A screen full of analytics data looks like a secret code, and in a way it is. That data has a lot of information in it, and it’s impossible to make sense of it without the key. Put another way, data can give answers, but only if you ask the right questions."""
84,DA,"Sir Timothy John Berners-Lee, Computer Scientist, Inventor of World Wide Web","The key is to let computers do what they are good at, which is trawling these massive data sets for something that is mathematically odd, and that makes it easier for humans to do what they are good at — explain those anomalies."
85,DA,"Fiona Roddis, Project Support at Jump Digital Ltd.",Data is a precious thing and will last longer than the systems themselves.
86,DA,"Jeff Allen, SrDirector of Product Marketing for Adobe Analytics","In a marketing analytics worldview, companies must have an accounting of and insight into all of their marketing programs in all of their channels, including web/browser, mobile apps, TV/video, social, paid media, field, print, outdoor and others. If your organization is still stuck in the web analytics mindset, it is time to reinvent your analytics practice, leveraging all of the available marketing analytics tools to make faster and better decisions and drive your business."
87,DA,"Jeff Sauer, Founder Jeffalytics, Digital Marketing Speaker, Professor and Consultant","For every $20 you spend on web analytics tools, you should spend $80 on the brains to make sense of the data."
88,DA,"Tom Conrad, Board Member at Sonos, formerly CTO at Pandora",As a publicly-traded company you have to do a lot of long-term planning with respect to revenue. You have to become more predictable for investors. And revenue is tied to products that have to ship to meet projections.
89,DA,"Julie Zhuo, Co-Founder at Inspirit, formerly VP of Product Design at Facebook","Data and A/B test are valuable allies, and they help us understand and grow and optimize, but they’re not a replacement for clear-headed, strong decision-making. Don’t become dependent on their allure. Sometimes, a little instinct goes a long way."
90,DA,"Monica Rogati, Data Science Advisor, Former VP of Data at Jawbone","The only thing that matters is getting to product/market fit. Product/market fit means being in a good market with a product that can satisfy that market. You can always feel when product/market fit isn’t happening. The customers aren’t quite getting value out of the product, word of mouth isn’t spreading, usage isn’t growing that fast, press reviews are kind of blah, the sales cycle takes too long, and lots of deals never close. And you can always feel product/market fit when it’s happening. The customers are buying the product just as fast as you can make it— or usage is growing just as fast as you can add more servers."
91,DA,"Mark Andreessen, Cofounder and General Partner at Andreessen Horowitz","A big theme that I keep coming back to is, where is the love? It’s basically just finding out which users are passionate about the product. What is the use case on the product that those people have? Why do they actually love the product? And that gives you a good core of information to guide every part of your business. So messaging, you want to reflect that, but also, now that you know that, you want to make sure that you can really get a lot more people to that particular type of use case and that particular type of gratifying experience. So understanding user gratification is really critical in all of it."
92,DA,"Sean Ellis, Co-creator at GoPractice and CEO and Founder at GrowthHackers","In my time as a product manager, I was constantly reminding myself to talk to customers more. It might have been to talk about existing features, something under development, or customer pain and processes for product research. It was easy in the beginning, because we knew most of the people using the tool as we worked on the initial version. Even as we got bigger, my feelings usually boiled down to these four words: talk to customers more. I think a critical skill, however, is learning how to talk to the right customers."
